<?xml version="1.0" encoding="UTF-8"?><!DOCTYPE Compony SYSTEM "ass3dtd.dtd"><Compony>	<Employee designation="Manager">		<Name>Priyanka Belhekar</Name>		<EmployeeId>100</EmployeeId>		<Salary>			<Basic unit="rs">30000</Basic>			<Allownces type="Extra" unit="rs">5000</Allownces>		</Salary>		<Contact>9527986037</Contact>		<Email>priyabelhekar26@gmail.com</Email>		<Dbirth>26th July,1997</Dbirth>		<Department>HR</Department>	</Employee></Compony>